{
  "schema_version": "tara5_action_v1",
  "chapter_id": "ch_0896",
  "source_novel": "dawang",
  "source_info": {
    "book_title": "dawang",
    "chapter_index": 896,
    "raw_file_name": "ch_0896.txt",
    "raw_text_char_count": 2281
  },
  "chapter_title": "第896章 武卫军统领吕小树",
  "prev_chapter_ending": "的想法就是……自己的选荐又凉了。\n吕树对自己的人生陷入了深深的怀疑……这特么想拿个选荐信就这么难吗，自己都落草为寇了还拿不到选荐信？！刚和叶晓明说好这事，结果叶晓明就战死了？这特么有毒吧！\n此时此刻吕树的内心卧了个大槽，黑羽军怎么偏偏就在这个时候杀了过来？\n吕树随着李黑炭往安山能远眺到云安城的地方赶过去，仅仅一眼吕树便确定云安城必然是要沦陷了，那黑羽军黑色的盔甲与烈马在武卫军中冲杀如龙，而武卫军的那些流浪儿只能奔头逃窜。\n只见一名身穿黑色重甲的骑兵忽然抬头朝安山方向看来，似乎远远的与吕树对视着！",
  "chapter_outline": [
    "吕树目睹黑羽军突袭武卫军，叶晓明战死导致武卫军溃散，吕树感叹选荐信落空。",
    "黑羽军击溃武卫军后南下，吕树分析其意图是断清塞军后路，并拒绝武卫军残兵求庇护。",
    "武卫军副统领刘谦之献上叶晓明虎符印信，率众跪求吕树担任新统领，吕树从犹豫到动心。",
    "吕树得知这批武卫军因愿意种花生而逃过一劫，最终半推半就接受统领之位，刘谦之宣誓效忠。"
  ],
  "confirmed_facts": [
    {
      "fact": "主角既定动机与初始算盘：吕树原本只想通过叶晓明获取选荐信加入武卫军，叶晓明死后计划落空，但意外获得成为武卫军统领的机会，他考虑接受以获取正式编制和势力。",
      "evidence": "前置态势与开端立意: '吕树静静的看着那黑色重甲的武将，而对方并没有静止很久，而是继续向武卫军冲杀而去，...'"
    },
    {
      "fact": "在场对手/配角的已知认知与本土判断：刘谦之等武卫军残兵误以为吕树是深藏不露的高手，认为奉其为统领能获得庇护和出路，并相信通过贿赂贵族可以坐实统领之位。",
      "evidence": "上章末尾承接依据: '的想法就是……自己的选荐又凉了。\n吕树对自己的人生陷入了深深的怀疑……这特么想拿...'"
    },
    {
      "fact": "当前对立双方的核心信息差与情报护城河：吕树并非吕宙世界原住民，对武卫军统领任命的松散规则和虎符印信的作用一无所知；刘谦之不知道吕树其实是个‘外人’，且对吕树的真实实力和背景存在误判。",
      "evidence": "本阶段既定设定与局势信息差记录"
    },
    {
      "fact": "局势所面临的客观死线压迫与倒计时：黑羽军正南下包抄清塞军，云安城已成鬼城，武卫军残兵急需庇护，吕树必须尽快决定是否接受统领之位以应对乱局。",
      "evidence": "本章开局死线与时间窗口要求"
    }
  ],
  "characters": [
    {
      "character_id": "char_protagonist",
      "name": "主角",
      "goal": "吕树原本只想通过叶晓明获取选荐信加入武卫军，叶晓明死后计划落空，但意外获得成为武卫军统领的机会，他考虑接受以获取正式编制和势力。",
      "known_info": [
        "吕树原本只想通过叶晓明获取选荐信加入武卫军，叶晓明死后计划落空，但意外获得成为武卫军统领的机会，他考虑接受以获取正式编制和势力。"
      ],
      "unknown_info": [
        "对手隐藏底牌与暗处杀招",
        "突发异变之真正源头与幕后因果"
      ],
      "misjudgment": ""
    },
    {
      "character_id": "char_antagonist",
      "name": "对手/配角",
      "goal": "刘谦之等武卫军残兵误以为吕树是深藏不露的高手，认为奉其为统领能获得庇护和出路，并相信通过贿赂贵族可以坐实统领之位。",
      "known_info": [
        "刘谦之等武卫军残兵误以为吕树是深藏不露的高手，认为奉其为统领能获得庇护和出路，并相信通过贿赂贵族可以坐实统领之位。"
      ],
      "unknown_info": [
        "吕树并非吕宙世界原住民，对武卫军统领任命的松散规则和虎符印信的作用一无所知；刘谦之不知道吕树其实是个‘外人’，且对吕树的真实实力和背景存在误判。"
      ],
      "misjudgment": "刘谦之等武卫军残兵误以为吕树是深藏不露的高手，认为奉其为统领能获得庇护和出路，并相信通过贿赂贵族可以坐实统领之位。"
    }
  ],
  "stage_plans": {
    "opening": {
      "stage_name": "opening",
      "responsibility": "黄金破题：承接上章余势，以强动作或即时处境开门见山，锁定破题定势",
      "preconditions": [
        "承接上一章结局或开篇新异变态势"
      ],
      "target_outcome": "确立开篇对抗态势，交代即时场景与处境",
      "length_budget": {
        "min_chars": 165,
        "max_chars": 287
      },
      "start_state": {
        "character_positions": {
          "主角": "开局初始位置"
        }
      },
      "end_state": {
        "character_stances": {
          "主角": "确立行动定势与应对姿态"
        }
      },
      "action_chain": [
        {
          "action_id": "act_op_01",
          "actor_id": "主角",
          "trigger": "开局承接",
          "action": "吕树目睹黑羽军突袭武卫军，叶晓明战死导致武卫军溃散，吕树感叹选荐信落空。",
          "reason": "打破前置平静，切入主线危机",
          "reaction": "对手或环境产生即时反馈",
          "result": "完成破题立势，确立开端态势",
          "depends_on": [],
          "evidence": "吕树静静的看着那黑色重甲的武将，而对方并没有静止很久，而是继续向武卫军冲杀而去，似乎是想将武卫军赶紧杀绝。"
        }
      ]
    },
    "ramp_up": {
      "stage_name": "ramp_up",
      "responsibility": "前向蓄水引信桥：从破题末锚推进至高潮首锚，层层加码矛盾与行动链",
      "preconditions": [
        "破题阶段已确立初始对峙"
      ],
      "target_outcome": "矛盾层层激化至临界爆发点，引信完全点燃",
      "length_budget": {
        "min_chars": 954,
        "max_chars": 1653
      },
      "start_state": {
        "character_positions": {
          "主角": "从破题位置向前推进"
        }
      },
      "end_state": {
        "character_stances": {
          "主角": "矛盾激化至爆发边缘，进入临界点"
        }
      },
      "action_chain": [
        {
          "action_id": "act_ru_01",
          "actor_id": "主角",
          "trigger": "破题局势确立后推进",
          "action": "黑羽军击溃武卫军后南下，吕树分析其意图是断清塞军后路，并拒绝武卫军残兵求庇护。",
          "reason": "升级矛盾，为高潮爆发完成必要铺垫与试探",
          "reaction": "各方博弈加剧，压迫感攀升",
          "result": "矛盾达到临界爆发点",
          "depends_on": [
            "act_op_01"
          ],
          "evidence": "现在武卫军连统领都没了，自己找谁要选荐信去？"
        }
      ]
    },
    "climax": {
      "stage_name": "climax",
      "responsibility": "高潮核爆：跳过铺垫前戏，直接围绕核心对决爆发全章最激烈对抗",
      "preconditions": [
        "蓄水阶段完成，矛盾无可回避，直接爆发"
      ],
      "target_outcome": "吕树从拒绝庇护到被献上虎符印信，面临成为武卫军统领的诱惑与内心挣扎。",
      "length_budget": {
        "min_chars": 308,
        "max_chars": 534
      },
      "start_state": {
        "character_stances": {
          "主角": "直面核心危机展开正面殊死对抗"
        }
      },
      "end_state": {
        "character_stances": {
          "主角": "完成核心对抗，决出即时结果"
        }
      },
      "action_chain": [
        {
          "action_id": "act_cl_01",
          "actor_id": "主角",
          "trigger": "危机引信烧尽，核心冲突全面爆发",
          "action": "吕树从拒绝庇护到被献上虎符印信，面临成为武卫军统领的诱惑与内心挣扎。",
          "reason": "兑现信息差，打破对手算盘",
          "reaction": "对手遭受重创或局势发生不可逆巨变",
          "result": "完成高潮核心事件，锁定胜负定势",
          "depends_on": [
            "act_ru_01"
          ],
          "evidence": "“这是叶晓明的虎符印信，如今叶晓明已死，武卫军已散，属下是武卫军副统领之一刘谦之，愿奉您为武卫军新统领！”说着，这名叫做刘谦之的副统领忽然单膝跪地，其余的武卫军也有模有样的跪了下去，刘谦之高声道：“我们这群人都是老老实实跟着您种花生的，愿意出力讨个出路，平日里就见不惯叶晓明的做派所以在武卫军内一直受到排挤和打压！”"
        }
      ]
    },
    "aftershock": {
      "stage_name": "aftershock",
      "responsibility": "余波转折桥：从高潮末锚平稳过渡，生理颤抖、搜刮清点与虚假安全感",
      "preconditions": [
        "高潮对决落幕，双方脱离直接激烈对抗"
      ],
      "target_outcome": "战局消化与复盘，平稳中继过渡至断章引信",
      "length_budget": {
        "min_chars": 210,
        "max_chars": 365
      },
      "start_state": {
        "character_stances": {
          "主角": "高潮消耗巨大，剧烈喘息并进入防备"
        },
        "injuries": {
          "主角": "承受战斗冲击或伤势反应"
        }
      },
      "end_state": {
        "cognitive_changes": {
          "主角": "刚获得短暂喘息，隐约感知到新隐患"
        }
      },
      "action_chain": [
        {
          "action_id": "act_af_01",
          "actor_id": "主角",
          "trigger": "激烈交锋停止，战局喘息",
          "action": "主角平复激荡气血与心绪，迅速消化战局并审视关键线索",
          "reason": "激斗初止，需防备暗处异动并确认战局遗留变数",
          "reaction": "战场肃杀渐消，新的暗流正在酝酿",
          "result": "平稳完成战后中继过渡，承接下一轮危机",
          "depends_on": [
            "act_cl_01"
          ],
          "evidence": "这吕宙世界是假的吧？！"
        }
      ]
    },
    "cliffhanger": {
      "stage_name": "cliffhanger",
      "responsibility": "致命断章：引爆全新维度异变或心理危机，矛盾巅峰处一刀封喉完成绝杀卡点",
      "preconditions": [
        "余波复盘完成，虚假安全感骤然被打破"
      ],
      "target_outcome": "引爆全新异变，在读者翻页欲望最高峰戛然而止",
      "length_budget": {
        "min_chars": 72,
        "max_chars": 192
      },
      "start_state": {
        "character_stances": {
          "主角": "猝不及防，神经再度紧绷"
        }
      },
      "end_state": {
        "cognitive_changes": {
          "主角": "直面未知异变，留下巨大悬念"
        }
      },
      "action_chain": [
        {
          "action_id": "act_ch_01",
          "actor_id": "主角",
          "trigger": "平静被全新异变骤然撕裂",
          "action": "吕树得知这批武卫军因愿意种花生而逃过一劫，最终半推半就接受统领之位，刘谦之宣誓效忠。",
          "reason": "直面超出预期的全新威胁",
          "reaction": "新危机瞬间笼罩全场",
          "result": "全章在矛盾与悬念最高峰处一刀封喉",
          "depends_on": [
            "act_af_01"
          ],
          "evidence": "那刘谦之一见这状况便大喜过望，他知道吕树动心了！"
        }
      ]
    }
  },
  "constraints": {
    "pov": "第三人称限制视角",
    "author_hard_requirements": [
      "严格遵守既定胜负与阶段结果",
      "行文自然流畅，杜绝机械复述提纲",
      "正文最后一句话一刀封喉戛然而止"
    ],
    "negative_constraints": [
      "严禁擅自新增未经设定的关键角色",
      "严禁颠覆既定胜负走向或死线设定",
      "严禁抢写或跨阶段提前解决后续情节"
    ],
    "allowed_creative_freedom": [
      "人物物理发力、微动作与表情细节自由发挥",
      "打斗博弈的节奏与措辞风格自由发挥",
      "环境与惊悚/紧张氛围描写自由发挥"
    ]
  },
  "segments": {
    "opening": {
      "text": "吕树静静的看着那黑色重甲的武将，而对方并没有静止很久，而是继续向武卫军冲杀而去，似乎是想将武卫军赶紧杀绝。\n\n原本黑羽军到来，武卫军应该是在城头防守的，但这支黑羽军精锐来的太过突然了，以至于武卫军还在城外的军营便被突袭而至。\n\n黑羽军这头黑龙，仅仅一个冲锋便将武卫军给打散，加上叶晓明回城途中刚好遇到黑羽军这种惨事导致武卫军群龙无首，搞得武卫军再难组织起有效的战力……\n\n吕树也感慨，这叶晓明真是成事不足败事有余，起码把他的选荐信给他再死啊？",
      "anchor_start": "吕树静静的看着那黑色重甲的武将，而对方并没有静止很久，而是继续向武卫军冲杀而去，似乎是想将武卫军赶紧杀绝。",
      "anchor_end": "吕树也感慨，这叶晓明真是成事不足败事有余，起码把他的选荐信给他再死啊？",
      "char_count": 221
    },
    "ramp_up": {
      "text": "现在武卫军连统领都没了，自己找谁要选荐信去？\n\n只见那支黑羽军硬生生在城外厮杀到了夜里，城内百姓一个个紧缩门户不敢出门，生怕这黑羽军一个不高兴来一次屠城。\n\n仗着兵强马壮，黑羽军三千人的兵马在一万多武卫军中如入无人之境，往往一个小小的冲锋便能吓的武卫军那群流浪儿们分头逃窜。\n\n黑色盔甲缝隙有血水滴下，他们的长矛都快染成了红色。\n\n武卫军的残兵败将们已经逃入深山，希望这支黑羽军骑兵不会弃马上山追杀。\n\n吕树和李黑炭时刻关注着这边，吕小鱼问他用不用出去看看，但吕树不让她出去。\n\n这会儿他已经确定那之前与他对视的黑羽军武将是一个一品高手，吕小鱼出去了万一被对方拦下来怎么办？\n\n眼瞅着黑羽军将武卫军彻底杀溃之后竟然直奔南方而去，连进城的打算都没有。这才是吕宙世界的精锐军队，吕树一眼看过去竟觉得同样人数来看，就算青铜洪流对上他们也只是平分秋色而已。\n\n不过青铜洪流胜在盔甲是法器，这些黑羽军的可不是。\n\n吕树看着黑羽军远去的身影想了半天：“这是要从后方去围杀清塞军的，主要目标并不是云安城，他们从这个最弱的地方撕出一条裂痕，其实还是想打南庚城那边的清塞军一个措手不及，这是想要断掉清塞军的后路啊……”\n\n云安城距离南庚城大概有六百余里，按照这支骑兵的脚力恐怕三天之内就能赶到，这还是非常省马匹脚力的行进速度，这吕宙世界的战马太过彪悍了一些。\n\n这样一支黑羽军过去，南庚城的清塞军想逃都逃不掉了吧。\n\n如今的云安城俨然变成了鬼城，整座城池里一点灯火都看不到，死气沉沉。老百姓们躲在家里噤若寒蝉，他们才是战争里最无助的人。\n\n忽然间身后有青龙寨的帮众跑来：“大王！有武卫军的士兵跑上来请求咱们青龙寨庇护。”\n\n吕树差点就笑了：“这特么正规军请求土匪庇护？也不嫌丢人吗？让他们走，我们没义务庇护他们。”\n\n帮众一路小跑走了，正在吕树观察山下情况的时候，那名帮众又跑了回来：“大王，他们说他们会种花生！”\n\n吕树：“……会种花生了不起啊……走，去看看。”\n\n吕树来到青龙寨的寨墙之上，墙外的武卫军逃兵黑压压的看不见尽头，吕树粗略一估算这怕是得有三千多人吧……\n\n武卫军的逃兵一个个都面带希冀的看着吕树，吕树平静道：“你们是正规军，我们是土匪，哪有土匪庇护正规军的道理？就算我想庇护你们，我这山寨也住不下这么多人啊。”\n\n“不用，我们睡城外就行，只求您不赶我们走！”有人喊道，喊话之人脸上黑黢黢的沾着泥土，一看就是逃命时贼拼命的那种……\n\n吕树还是想拒绝：“关键是这说出去也不好听啊，我跟武卫军无亲无故的……师出无名啊。”\n\n这时有人忽然扔上来一个东西，吕树一开始以为是暗器呢，结果主教一手抓住那物件递给吕树，吕树愣住了：“这是啥？”\n\n“这是叶晓明的虎符印信，如今叶晓明已死，武卫军已散，属下是武卫军副统领之一刘谦之，愿奉您为武卫军新统领！”说着，这名叫做刘谦之的副统领忽然单膝跪地，其余的武卫军也有模有样的跪了下去，刘谦之高声道：“我们这群人都是老老实实跟着您种花生的，愿意出力讨个出路，平日里就见不惯叶晓明的做派所以在武卫军内一直受到排挤和打压！”",
      "anchor_start": "现在武卫军连统领都没了，自己找谁要选荐信去？",
      "anchor_end": "“这是叶晓明的虎符印信，如今叶晓明已死，武卫军已散，属下是武卫军副统领之一刘谦之，愿奉您为武卫军新统领！”说着，这名叫做刘谦之的副统领忽然单膝跪地，其余的武卫军也有模有样的跪了下去，刘谦之高声道：“我们这群人都是老老实实跟着您种花生的，愿意出力讨个出路，平日里就见不惯叶晓明的做派所以在武卫军内一直受到排挤和打压！”",
      "char_count": 1272
    },
    "climax": {